{
  "format": "atropos-model-pack",
  "schema_version": 2,
  "id": "atropos.core",
  "name": "Atropos Core Models",
  "version": "1.10.0",
  "license": "CC-BY-4.0",
  "license_file": "LICENSE",
  "languages": [
    "c",
    "javascript",
    "python",
    "typescript"
  ],
  "model_globs": [
    "models/**/*.json"
  ],
  "runtime_globs": [
    "profiles/**/*.json",
    "detection/**/*.json"
  ],
  "verified_entries": 1618,
  "candidate_files": [
    "candidates/**/*.json"
  ],
  "source_repository": "https://github.com/UnboundCompute/atropos",
  "provenance": {
    "source_of_truth": "VERSION plus model files in this checkout",
    "binding_required": true,
    "candidate_rows_are_consumed": false
  }
}
